{
  "schemaVersion": "1.0.0",
  "version": "1.0.0",
  "worldId": "cedar-world",
  "worldPath": "fixtures/worlds/cedar-world.json",
  "worldHash": "6b66717e99f0be0b812c5968034a8a4f5272c1eb6c163d97681300bc505358fb",
  "entityIds": [
    "builder-0a4d851f8c7d",
    "lead-a-daf57e15f8fa"
  ],
  "expectedFacts": {
    "facts.json#/approvalSource": "none"
  }
}
