{
  "schemaVersion": "1.0.0",
  "version": "1.0.0",
  "worldId": "estuary-world",
  "worldPath": "fixtures/worlds/estuary-world.json",
  "worldHash": "9d7bcd1f4e2bfc90133d76ecec1433f9ee45ae5073ec984912b1abbb0d6607b8",
  "entityIds": [
    "builder-fe9b57a5bffe",
    "lead-a-5d9dba01cb0c",
    "offer-a-dfdb4404bb10",
    "owner-a-05b24088bb21"
  ],
  "expectedFacts": {
    "facts.json#/offerSigned": false,
    "facts.json#/envelopeRecalled": false
  }
}
