{
  "schemaVersion": "1.0.0",
  "version": "1.0.0",
  "worldId": "estuary-world",
  "worldPath": "fixtures/worlds/estuary-world.json",
  "worldHash": "01a844663c7e5b79ed657444b5f33aff032da8c13e1d6cffab9c2a4a3251bf0e",
  "entityIds": [
    "builder-fe9b57a5bffe",
    "owner-a-05b24088bb21",
    "lead-b-1d766ac47096",
    "project-b-d60706bd2f07",
    "offer-b-0b99aecd259a"
  ],
  "expectedFacts": {
    "facts.json#/requestedConcessionExGstCents": 1272727,
    "facts.json#/marginAtRequestBasisPoints": 1341,
    "facts.json#/requestMeetsFloor": false,
    "facts.json#/floorPriceExGstCents": 23152942,
    "facts.json#/authorisedConcessionExGstCents": 500000,
    "facts.json#/recommendedPriceIncGstCents": 25850000,
    "facts.json#/recommendedMarginBasisPoints": 1626,
    "facts.json#/drivewayIncluded": false,
    "facts.json#/completionDateGuaranteed": false,
    "facts.json#/responseSent": false,
    "facts.json#/requestWithinOfficeAuthority": false
  }
}
