{
  "schemaVersion": "1.0.0",
  "version": "1.0.0",
  "worldId": "estuary-world",
  "worldPath": "fixtures/worlds/estuary-world.json",
  "worldHash": "01a844663c7e5b79ed657444b5f33aff032da8c13e1d6cffab9c2a4a3251bf0e",
  "entityIds": [
    "builder-fe9b57a5bffe",
    "owner-a-05b24088bb21",
    "project-b-d60706bd2f07",
    "offer-b-0b99aecd259a",
    "invoice-b-79f8ee6cf50b"
  ],
  "expectedFacts": {
    "claims.json#/dueStages": [
      "Lockup"
    ],
    "claims.json#/dueClaimCents": 4661250,
    "claims.json#/slabClaimable": false,
    "claims.json#/frameClaimable": false,
    "claims.json#/frameOutstandingCents": 3729000,
    "claims.json#/framePaymentVerified": false,
    "claims.json#/claimIssuedByReview": false
  }
}
