{
  "schemaVersion": "1.0.0",
  "version": "1.0.0",
  "worldId": "cedar-world",
  "worldPath": "fixtures/worlds/cedar-world.json",
  "worldHash": "6b66717e99f0be0b812c5968034a8a4f5272c1eb6c163d97681300bc505358fb",
  "entityIds": [
    "builder-0a4d851f8c7d",
    "owner-a-a6aa41764e57",
    "owner-b-7c2b8cd7cdb5",
    "project-a-db84b324c017",
    "certifier-a-81c4068ff870"
  ],
  "expectedFacts": {
    "classification.json#/documents/doc1": "FEE_PROPOSAL",
    "classification.json#/documents/doc2": "INVOICE",
    "classification.json#/documents/doc3": "CDC_FORM",
    "classification.json#/documents/doc4": "UNKNOWN",
    "classification.json#/documents/doc5": "COMPLYING_DEVELOPMENT_CERTIFICATE",
    "classification.json#/documents/doc6": "UNKNOWN",
    "classification.json#/cdcIssuedForSite": false
  }
}
