{
  "schemaVersion": "1.0.0",
  "version": "1.0.0",
  "worldId": "cedar-world",
  "worldPath": "fixtures/worlds/cedar-world.json",
  "worldHash": "c855ee2914134b034496b68506a03828d0562f697e9051b53ebf355475287a45",
  "entityIds": [
    "builder-0a4d851f8c7d",
    "owner-a-a6aa41764e57",
    "owner-b-7c2b8cd7cdb5",
    "lead-a-daf57e15f8fa",
    "lead-b-c0ba330fa98c",
    "project-a-db84b324c017",
    "offer-a-ae79134d7faf",
    "tradie-a-1d598b7c2731",
    "certifier-a-81c4068ff870",
    "document-a-9bccd7eb4323",
    "invoice-a-166401216f23",
    "lead-unknown-af32be939ab0",
    "lead-lost-649785fac5de"
  ],
  "expectedFacts": {
    "costBaseCents": 51200000,
    "overheadCents": 5120000,
    "feeCents": 4096000,
    "contractCents": 66457600
  }
}
