{
  "schemaVersion": "1.0.0",
  "version": "1.0.0",
  "worldId": "estuary-world",
  "worldPath": "fixtures/worlds/estuary-world.json",
  "worldHash": "01a844663c7e5b79ed657444b5f33aff032da8c13e1d6cffab9c2a4a3251bf0e",
  "entityIds": [
    "builder-fe9b57a5bffe",
    "project-a-154b18acb8e5",
    "lead-a-5d9dba01cb0c"
  ],
  "expectedFacts": {
    "facts.json#/craneDate": "2026-10-14",
    "facts.json#/asbestosClearanceReceived": true,
    "facts.json#/actionsTaken": []
  }
}
