{
  "schemaVersion": "1.0.0",
  "version": "1.0.0",
  "worldId": "estuary-world",
  "worldPath": "fixtures/worlds/estuary-world.json",
  "worldHash": "01a844663c7e5b79ed657444b5f33aff032da8c13e1d6cffab9c2a4a3251bf0e",
  "entityIds": [
    "builder-fe9b57a5bffe",
    "project-a-154b18acb8e5",
    "tradie-a-7bc28fb3c9fb",
    "certifier-a-c354973fe733"
  ],
  "expectedFacts": {
    "facts.json#/sent": false,
    "facts.json#/recipientTradieId": "estuary-surveyor",
    "facts.json#/cancelled": true
  }
}
