{
  "schemaVersion": "1.0.0",
  "version": "1.0.0",
  "worldId": "estuary-world",
  "worldPath": "fixtures/worlds/estuary-world.json",
  "worldHash": "9d7bcd1f4e2bfc90133d76ecec1433f9ee45ae5073ec984912b1abbb0d6607b8",
  "entityIds": [
    "builder-fe9b57a5bffe",
    "owner-a-05b24088bb21",
    "project-a-154b18acb8e5",
    "certifier-a-c354973fe733"
  ],
  "expectedFacts": {
    "verdict.json#/verdict": "rejected",
    "verdict.json#/reason": "The assessment must rate the northern boundary as BAL-29 and show the 1.8 m radiant heat barrier required by our estate design guidelines.",
    "verdict.json#/decidingMessage": "msg3"
  }
}
