{
  "schemaVersion": "1.0.0",
  "version": "1.0.0",
  "worldId": "cedar-world",
  "worldPath": "fixtures/worlds/cedar-world.json",
  "worldHash": "6b66717e99f0be0b812c5968034a8a4f5272c1eb6c163d97681300bc505358fb",
  "entityIds": [
    "builder-0a4d851f8c7d",
    "project-a-db84b324c017",
    "owner-a-a6aa41764e57",
    "owner-b-7c2b8cd7cdb5",
    "certifier-a-81c4068ff870"
  ],
  "expectedFacts": {
    "readiness.json#/cdcSendAllowed": false,
    "readiness.json#/route": "DA",
    "readiness.json#/nextAction": "prepare-da-route-with-architect"
  }
}
