{
  "schemaVersion": "1.0.0",
  "version": "1.0.0",
  "worldId": "cedar-world",
  "worldPath": "fixtures/worlds/cedar-world.json",
  "worldHash": "6b66717e99f0be0b812c5968034a8a4f5272c1eb6c163d97681300bc505358fb",
  "entityIds": [
    "builder-0a4d851f8c7d",
    "owner-a-a6aa41764e57",
    "owner-b-7c2b8cd7cdb5",
    "project-a-db84b324c017",
    "invoice-a-166401216f23",
    "tradie-a-1d598b7c2731"
  ],
  "expectedFacts": {
    "facts.json#/closingCashCents": 4978260,
    "facts.json#/outstandingReceivablesCents": 11992640,
    "facts.json#/overdueInvoices": [
      "INV-C-011"
    ],
    "facts.json#/commitmentsInWindowCents": 8860000,
    "facts.json#/forecastCollectionsCents": 9968640,
    "facts.json#/projectedCashCents": 6086900,
    "facts.json#/inv012PaymentVerified": false,
    "facts.json#/receiptsCents": 11045760
  }
}
