{
  "schemaVersion": "1.0.0",
  "version": "1.0.0",
  "worldId": "cedar-world",
  "worldPath": "fixtures/worlds/cedar-world.json",
  "worldHash": "c855ee2914134b034496b68506a03828d0562f697e9051b53ebf355475287a45",
  "entityIds": [
    "builder-0a4d851f8c7d",
    "owner-a-a6aa41764e57",
    "owner-b-7c2b8cd7cdb5",
    "project-a-db84b324c017"
  ],
  "expectedFacts": {
    "title-check.json#/verdict": "indeterminate",
    "title-check.json#/nextAction": "obtain-readable-search"
  }
}
