{
  "schemaVersion": "1.0.0",
  "version": "1.0.0",
  "worldId": "cedar-world",
  "worldPath": "fixtures/worlds/cedar-world.json",
  "worldHash": "6b66717e99f0be0b812c5968034a8a4f5272c1eb6c163d97681300bc505358fb",
  "entityIds": [
    "builder-0a4d851f8c7d",
    "owner-a-a6aa41764e57",
    "owner-b-7c2b8cd7cdb5",
    "lead-a-daf57e15f8fa",
    "offer-a-ae79134d7faf"
  ],
  "expectedFacts": {
    "price.json#/currentRevision": 3,
    "price.json#/priceOfRecordCents": 66457600,
    "price.json#/revisionPriceCents/1": 64218000,
    "price.json#/revisionPriceCents/2": null,
    "price.json#/overrideVarianceCents": -437400,
    "price.json#/computedPriceCents": 66895000,
    "price.json#/overrideReasonRecorded": true,
    "price.json#/printedAmountMatches": true
  }
}
